id,title,score,num_comments,author,created_utc,url,over_18,edited,spoiler,stickied
1i7vw5c,Python tests in interviews,53,27,OreosAreAiight,2025-01-23 04:59:23,https://www.reddit.com/r/dataengineering/comments/1i7vw5c/python_tests_in_interviews/,False,False,False,False
1i83o9t,transition out of DE to where?,29,25,Significant-Carob897,2025-01-23 13:45:37,https://www.reddit.com/r/dataengineering/comments/1i83o9t/transition_out_of_de_to_where/,False,False,False,False
1i7yff8,Zero-Disk Architecture: The Future of Cloud Storage Systems,17,1,ithoughtful,2025-01-23 07:53:24,https://practicaldataengineering.substack.com/p/zero-disk-architecture-the-future,False,False,False,False
1i87ce2,Is DP-700 Worth It for a New Learner in Data Engineering?,11,8,shurmimen_dude,2025-01-23 16:30:32,https://www.reddit.com/r/dataengineering/comments/1i87ce2/is_dp700_worth_it_for_a_new_learner_in_data/,False,False,False,False
1i7x27y,Help required to understand the tech stack needed for creation of a data warehouse.,8,6,whatshouldidotoknow,2025-01-23 06:13:36,https://www.reddit.com/r/dataengineering/comments/1i7x27y/help_required_to_understand_the_tech_stack_needed/,False,False,False,False
1i7rfzu,First time feeling like the belle of the ball,8,4,SuperTangelo1898,2025-01-23 01:06:35,https://www.reddit.com/r/dataengineering/comments/1i7rfzu/first_time_feeling_like_the_belle_of_the_ball/,False,False,False,False
1i8dn6m,Amazon vs Meta for Data Engineering Internship??,8,20,No-Substance-3796,2025-01-23 20:50:01,https://www.reddit.com/r/dataengineering/comments/1i8dn6m/amazon_vs_meta_for_data_engineering_internship/,False,False,False,False
1i83me0,Reevaluating Data Lake Architectures for Event-Driven Pipelines: Seeking Advice,9,6,Significant_Pin_920,2025-01-23 13:43:04,https://www.reddit.com/r/dataengineering/comments/1i83me0/reevaluating_data_lake_architectures_for/,False,False,False,False
1i8f4dn,OSS & MDS in the enterprise: dagster & dbt,5,0,geoheil,2025-01-23 21:51:39,https://www.reddit.com/r/dataengineering/comments/1i8f4dn/oss_mds_in_the_enterprise_dagster_dbt/,False,False,False,False
1i83ros,Getting data from an API that lacks sorting,7,29,dfwtjms,2025-01-23 13:50:26,https://www.reddit.com/r/dataengineering/comments/1i83ros/getting_data_from_an_api_that_lacks_sorting/,False,False,False,False
1i83loh,Amazon Redshift to S3 Iceberg Databricks,4,2,SnooMuffins9461,2025-01-23 13:42:01,https://www.reddit.com/r/dataengineering/comments/1i83loh/amazon_redshift_to_s3_iceberg_databricks/,False,False,False,False
1i81utq,Is it possible to schedule an Apache Airflow pipeline based on WebSocket messages?,5,1,skwyckl,2025-01-23 12:05:54,https://www.reddit.com/r/dataengineering/comments/1i81utq/is_it_possible_to_schedule_an_apache_airflow/,False,False,False,False
1i8grzd,Building Analytics Apps on Your Data,4,5,AMDataLake,2025-01-23 23:03:40,https://www.reddit.com/r/dataengineering/comments/1i8grzd/building_analytics_apps_on_your_data/,False,False,False,False
1i8cm7c,Azure Data Factory Python SDK,4,1,aliuta,2025-01-23 20:06:59,https://www.reddit.com/r/dataengineering/comments/1i8cm7c/azure_data_factory_python_sdk/,False,False,False,False
1i8afan,Does this architecture make sense—using the Dbt Semantic Layer and Metrics with the Lakehouse?,3,0,DuckDatum,2025-01-23 18:36:35,https://www.reddit.com/r/dataengineering/comments/1i8afan/does_this_architecture_make_senseusing_the_dbt/,False,False,False,False
1i89c4i,Building a near-real-time data lake with the LOAD stack,2,0,mwylde_,2025-01-23 17:52:49,https://www.arroyo.dev/blog/building-a-real-time-data-lake,False,False,False,False
1i8izpw,Dagster’s new docs,17,2,MrMosBiggestFan,2025-01-24 00:46:18,https://docs.dagster.io/,False,False,False,False
1i8hgfz,Using AWS’ DynamoDB connector to write high volume from Databricks to DynamoDB,3,1,TheConSpooky,2025-01-23 23:34:43,https://www.reddit.com/r/dataengineering/comments/1i8hgfz/using_aws_dynamodb_connector_to_write_high_volume/,False,False,False,False
1i7yczj,"Show /r/dataengineering: A simple, high volume, NCSA log generator for testing your log processing pipelines",3,3,Iron_Yuppie,2025-01-23 07:47:58,https://www.reddit.com/r/dataengineering/comments/1i7yczj/show_rdataengineering_a_simple_high_volume_ncsa/,False,False,False,False
1i8hp34,Biggest Pain in Your Current Architecture,2,1,AMDataLake,2025-01-23 23:45:29,https://www.reddit.com/r/dataengineering/comments/1i8hp34/biggest_pain_in_your_current_architecture/,False,False,False,False
1i8g96a,Issue with AWS Redshift,2,0,Distinct-Repeat3306,2025-01-23 22:40:22,https://www.reddit.com/r/dataengineering/comments/1i8g96a/issue_with_aws_redshift/,False,False,False,False
1i8f4l2,[Help Needed] Issues with AWS Glue & Athena in AWS Data Engineering Lab – Views & Queries Not Creating Properly,2,1,LiveUpTo,2025-01-23 21:51:54,https://www.reddit.com/r/dataengineering/comments/1i8f4l2/help_needed_issues_with_aws_glue_athena_in_aws/,False,False,False,False
1i86y6p,What is your QA and release Way of work.,2,2,hrabia-mariusz,2025-01-23 16:13:58,https://www.reddit.com/r/dataengineering/comments/1i86y6p/what_is_your_qa_and_release_way_of_work/,False,False,False,False
1i86ttr,Contributing to open source data engineering projects,2,1,antiSemiColonist,2025-01-23 16:08:48,https://www.reddit.com/r/dataengineering/comments/1i86ttr/contributing_to_open_source_data_engineering/,False,False,False,False
1i858s9,Azure Databricks Standard Workspace,2,0,Historical_Target489,2025-01-23 15:00:17,https://www.reddit.com/r/dataengineering/comments/1i858s9/azure_databricks_standard_workspace/,False,False,False,False
1i84qzp,Advice on how to deal with structured data sources,2,3,Weekly-Stomach420,2025-01-23 14:37:04,https://www.reddit.com/r/dataengineering/comments/1i84qzp/advice_on_how_to_deal_with_structured_data_sources/,False,False,False,False
1i82987,How do I design a DBX system for reporting and not real time?,2,3,codeamatic,2025-01-23 12:29:34,https://www.reddit.com/r/dataengineering/comments/1i82987/how_do_i_design_a_dbx_system_for_reporting_and/,False,False,False,False
1i7rhyf,"SaaS, K8s or… (how do you deploy)",2,2,AMDataLake,2025-01-23 01:09:17,https://www.reddit.com/r/dataengineering/comments/1i7rhyf/saas_k8s_or_how_do_you_deploy/,False,False,False,False
1i8dups,Early career at scale-up - should I stay or should I go?,1,2,Euphoric-Clue-4973,2025-01-23 20:58:53,https://www.reddit.com/r/dataengineering/comments/1i8dups/early_career_at_scaleup_should_i_stay_or_should_i/,False,False,False,False
1i8cdrw,"What are some of the prestigious DE conferences, publications etc??",1,1,NefariousnessSea5101,2025-01-23 19:57:30,https://www.reddit.com/r/dataengineering/comments/1i8cdrw/what_are_some_of_the_prestigious_de_conferences/,False,False,False,False
1i85eu2,"Flow for email notification, by excel modification",1,0,A1NUUU,2025-01-23 15:07:27,https://www.reddit.com/r/dataengineering/comments/1i85eu2/flow_for_email_notification_by_excel_modification/,False,False,False,False
1i7sk2l,Disconnect ADF from git,1,0,EmpCodel,2025-01-23 02:00:57,https://www.reddit.com/r/dataengineering/comments/1i7sk2l/disconnect_adf_from_git/,False,False,False,False
1i8cyw9,Validoopsie: Data Validation Made Effortless!,1,1,wioym,2025-01-23 20:21:56,https://www.reddit.com/r/dataengineering/comments/1i8cyw9/validoopsie_data_validation_made_effortless/,False,False,False,False
1i8ck60,Can agentic AI create a DE pipeline or replace a Junior / Senior DE?,0,21,NefariousnessSea5101,2025-01-23 20:04:32,https://www.reddit.com/r/dataengineering/comments/1i8ck60/can_agentic_ai_create_a_de_pipeline_or_replace_a/,False,False,False,False
1i7v8rt,Need Help In Data engineering job,0,2,AmbitiousCompote2073,2025-01-23 04:21:18,https://www.reddit.com/r/dataengineering/comments/1i7v8rt/need_help_in_data_engineering_job/,False,False,False,False
1i89umx,With trump and everything else… how is DE job market gonna be?,0,27,NefariousnessSea5101,2025-01-23 18:13:36,https://www.reddit.com/r/dataengineering/comments/1i89umx/with_trump_and_everything_else_how_is_de_job/,False,False,False,False
